<?xml version="1.0" encoding="UTF-8"?>
<xs:schema xmlns:xs="http://www.w3.org/2001/XMLSchema">
  <xs:element name="library">
    <xs:complexType>
      <xs:sequence>
        <xs:element name="constants" minOccurs="0" maxOccurs="unbounded">
          <xs:complexType>
            <xs:sequence>
              <xs:element name="constant" minOccurs="0" maxOccurs="unbounded">
                <xs:complexType>
                  <xs:attribute name="name" type="xs:string" use="required"/>
                  <xs:attribute name="icon" type="xs:string" use="required"/>
                  <xs:attribute name="factory" type="xs:string" use="required"/>
                  <xs:attribute name="description" type="xs:string"/>
                </xs:complexType>
              </xs:element>
            </xs:sequence>
            <xs:attribute name="name" type="xs:string" use="required"/>
            <xs:attribute name="icon" type="xs:string" use="required"/>
            <xs:attribute name="description" type="xs:string"/>
          </xs:complexType>
        </xs:element>
        <xs:element name="blocks" minOccurs="0" maxOccurs="unbounded">
          <xs:complexType>
            <xs:sequence>
              <xs:element name="block" minOccurs="0" maxOccurs="unbounded">
                <xs:complexType>
                  <xs:sequence>
                    <xs:element name="param" minOccurs="0" maxOccurs="unbounded">
                      <xs:complexType>
                        <xs:attribute name="name" type="xs:string" use="required"/>
                        <xs:attribute name="icon" type="xs:string"/>
                        <xs:attribute name="description" type="xs:string"/>
                      </xs:complexType>
                    </xs:element>
                  </xs:sequence>
                  <xs:attribute name="name" type="xs:string" use="required"/>
                  <xs:attribute name="icon" type="xs:string" use="required"/>
                  <xs:attribute name="factory" type="xs:string" use="required"/>
                  <xs:attribute name="method" type="xs:string" use="required"/>
                  <xs:attribute name="description" type="xs:string"/>
                </xs:complexType>
              </xs:element>
            </xs:sequence>
            <xs:attribute name="name" type="xs:string" use="required"/>
            <xs:attribute name="icon" type="xs:string" use="required"/>
            <xs:attribute name="description" type="xs:string"/>
          </xs:complexType>
        </xs:element>
        <xs:element name="type" minOccurs="0" maxOccurs="unbounded">
          <xs:complexType>
            <xs:sequence>
              <xs:element name="input" minOccurs="0" maxOccurs="unbounded">
                <xs:complexType>
                  <xs:attribute name="name" type="xs:string" use="required"/>
                  <xs:attribute name="icon" type="xs:string"/>
                  <xs:attribute name="description" type="xs:string"/>
                </xs:complexType>
              </xs:element>
              <xs:element name="output" minOccurs="0" maxOccurs="unbounded">
                <xs:complexType>
                  <xs:attribute name="name" type="xs:string" use="required"/>
                  <xs:attribute name="icon" type="xs:string"/>
                  <xs:attribute name="description" type="xs:string"/>
                </xs:complexType>
              </xs:element>
            </xs:sequence>
            <xs:attribute name="name" type="xs:string" use="required"/>
            <xs:attribute name="icon" type="xs:string" use="required"/>
            <xs:attribute name="description" type="xs:string"/>
          </xs:complexType>
        </xs:element>
      </xs:sequence>
      <xs:attribute name="name" type="xs:string" use="required"/>
      <xs:attribute name="icon" type="xs:string" use="required"/>
    </xs:complexType>
  </xs:element>
</xs:schema>
